[
  {
    "slug": "24",
    "name": "24",
    "opdb_group_id": "GrEkZ",
    "franchise_slug": "24"
  },
  {
    "slug": "ac-dc",
    "name": "AC/DC",
    "opdb_group_id": "G43W4",
    "franchise_slug": "ac-dc"
  },
  {
    "slug": "aerosmith",
    "name": "Aerosmith",
    "opdb_group_id": "Gr16e",
    "franchise_slug": "aerosmith"
  },
  {
    "slug": "alice-cooper",
    "name": "Alice Cooper's Nightmare Castle",
    "opdb_group_id": "GrlXK",
    "franchise_slug": "alice-cooper"
  },
  {
    "slug": "alien",
    "name": "Alien",
    "opdb_group_id": "G4PBO",
    "franchise_slug": "alien"
  },
  {
    "slug": "apollo-13",
    "name": "Apollo 13",
    "opdb_group_id": "G411e",
    "franchise_slug": "apollo-13"
  },
  {
    "slug": "austin-powers",
    "name": "Austin Powers",
    "opdb_group_id": "G43BW",
    "franchise_slug": "austin-powers"
  },
  {
    "slug": "avatar",
    "name": "Avatar",
    "opdb_group_id": "GrZBr",
    "franchise_slug": "avatar"
  },
  {
    "slug": "avengers-infinity-quest",
    "name": "Avengers: Infinity Quest",
    "opdb_group_id": "Gj66P",
    "franchise_slug": "the-avengers"
  },
  {
    "slug": "back-to-the-future",
    "name": "Back to the Future",
    "opdb_group_id": "GRpbW",
    "franchise_slug": "back-to-the-future"
  },
  {
    "slug": "barb-wire",
    "name": "Barb Wire",
    "opdb_group_id": "GRwyv",
    "franchise_slug": "barb-wire"
  },
  {
    "slug": "batman",
    "name": "Batman",
    "opdb_group_id": "G4yVw",
    "franchise_slug": "batman"
  },
  {
    "slug": "batman-66",
    "name": "Batman 66",
    "opdb_group_id": "GRoz4",
    "franchise_slug": "batman"
  },
  {
    "slug": "batman-data-east",
    "name": "Batman",
    "opdb_group_id": "GrOpb",
    "franchise_slug": "batman"
  },
  {
    "slug": "batman-forever",
    "name": "Batman Forever",
    "opdb_group_id": "G59zN",
    "franchise_slug": "batman"
  },
  {
    "slug": "baywatch",
    "name": "Baywatch",
    "opdb_group_id": "Grxvy",
    "franchise_slug": "baywatch"
  },
  {
    "slug": "big-buck-hunter",
    "name": "Big Buck Hunter Pro",
    "opdb_group_id": "G4N6n",
    "franchise_slug": "big-buck-hunter"
  },
  {
    "slug": "black-knight",
    "name": "Black Knight",
    "opdb_group_id": "GrO7w",
    "series_slug": "black-knight"
  },
  {
    "slug": "black-knight-2000",
    "name": "Black Knight 2000",
    "opdb_group_id": "GrxPP",
    "series_slug": "black-knight"
  },
  {
    "slug": "black-knight-sword-of-rage",
    "name": "Black Knight: Sword of Rage",
    "opdb_group_id": "GD7Ld",
    "series_slug": "black-knight"
  },
  {
    "slug": "black-velvet",
    "name": "Black Velvet",
    "opdb_group_id": "GRw0Z",
    "franchise_slug": "black-velvet"
  },
  {
    "slug": "bride-of-pinbot",
    "name": "Bride of Pinbot",
    "opdb_group_id": "GRpee",
    "series_slug": "pinbot"
  },
  {
    "slug": "bugs-bunnys-birthday-ball",
    "name": "Bugs Bunny's Birthday Ball",
    "opdb_group_id": "GRozL",
    "franchise_slug": "looney-tunes"
  },
  {
    "slug": "camel",
    "name": "Camel Lights",
    "opdb_group_id": "G43KY",
    "franchise_slug": "camel"
  },
  {
    "slug": "charlies-angels",
    "name": "Charlie’s Angels",
    "opdb_group_id": "G5Woz",
    "franchise_slug": "charlies-angels"
  },
  {
    "slug": "close-encounters",
    "name": "Close Encounters of the Third Kind",
    "opdb_group_id": "G4qvL",
    "franchise_slug": "close-encounters"
  },
  {
    "slug": "congo",
    "name": "Congo",
    "opdb_group_id": "GrNd0",
    "franchise_slug": "congo"
  },
  {
    "slug": "creature-from-the-black-lagoon",
    "name": "Creature from the Black Lagoon",
    "opdb_group_id": "GrNWn",
    "franchise_slug": "universal-monsters"
  },
  {
    "slug": "csi",
    "name": "CSI: Crime Scene Investigation",
    "opdb_group_id": "GRokz",
    "franchise_slug": "csi"
  },
  {
    "slug": "deadpool",
    "name": "Deadpool",
    "opdb_group_id": "G6lnq",
    "franchise_slug": "deadpool"
  },
  {
    "slug": "demolition-man",
    "name": "Demolition Man",
    "opdb_group_id": "G5bv3",
    "franchise_slug": "demolition-man"
  },
  {
    "slug": "dirty-harry",
    "name": "Dirty Harry",
    "opdb_group_id": "GrJ2Z",
    "franchise_slug": "dirty-harry"
  },
  {
    "slug": "doctor-who",
    "name": "Doctor Who",
    "opdb_group_id": "G4x2Y",
    "franchise_slug": "doctor-who"
  },
  {
    "slug": "dolly-parton",
    "name": "Dolly Parton",
    "opdb_group_id": "G43Yq",
    "franchise_slug": "dolly-parton"
  },
  {
    "slug": "dominos",
    "name": "Domino's Spectacular Pinball Adventure",
    "opdb_group_id": "GxvQ7",
    "franchise_slug": "dominos"
  },
  {
    "slug": "dracula",
    "name": "Bram Stoker's Dracula",
    "opdb_group_id": "G41do",
    "franchise_slug": "dracula"
  },
  {
    "slug": "dune",
    "name": "Dune",
    "opdb_group_id": "Gd266",
    "franchise_slug": "dune"
  },
  {
    "slug": "eight-ball",
    "name": "Eight Ball",
    "opdb_group_id": "GrN7J",
    "series_slug": "eight-ball"
  },
  {
    "slug": "eight-ball-champ",
    "name": "Eight Ball Champ",
    "opdb_group_id": "G439V",
    "series_slug": "eight-ball"
  },
  {
    "slug": "eight-ball-deluxe",
    "name": "Eight Ball Deluxe",
    "opdb_group_id": "G5KXk",
    "series_slug": "eight-ball"
  },
  {
    "slug": "elton-john",
    "name": "Captain Fantastic and the Brown Dirt Cowboy",
    "opdb_group_id": "GRveZ",
    "franchise_slug": "elton-john"
  },
  {
    "slug": "elvira-and-the-party-monsters",
    "name": "Elvira and the Party Monsters",
    "opdb_group_id": "Grlxp",
    "franchise_slug": "elvira"
  },
  {
    "slug": "elviras-house-of-horrors",
    "name": "Elvira's House of Horrors",
    "opdb_group_id": "GZVOd",
    "franchise_slug": "elvira"
  },
  {
    "slug": "elvis",
    "name": "Elvis",
    "opdb_group_id": "G4qbX",
    "franchise_slug": "elvis"
  },
  {
    "slug": "evel-knievel",
    "name": "Evel Knievel",
    "opdb_group_id": "G59wx",
    "franchise_slug": "evel-knievel"
  },
  {
    "slug": "family-guy",
    "name": "Family Guy / Shrek",
    "opdb_group_id": "G5LW9",
    "franchise_slug": "family-guy"
  },
  {
    "slug": "flash-gordon",
    "name": "Flash Gordon",
    "opdb_group_id": "G5728",
    "franchise_slug": "flash-gordon"
  },
  {
    "slug": "frankenstein",
    "name": "Mary Shelley's Frankenstein",
    "opdb_group_id": "GRB7E",
    "franchise_slug": "frankenstein"
  },
  {
    "slug": "game-of-thrones",
    "name": "Game of Thrones",
    "opdb_group_id": "G41d5",
    "franchise_slug": "game-of-thrones"
  },
  {
    "slug": "ghostbusters",
    "name": "Ghostbusters",
    "opdb_group_id": "GR9Nr",
    "franchise_slug": "ghostbusters"
  },
  {
    "slug": "gilligans-island",
    "name": "Gilligan's Island",
    "opdb_group_id": "GRBxQ",
    "franchise_slug": "gilligans-island"
  },
  {
    "slug": "godzilla",
    "name": "Godzilla",
    "opdb_group_id": "G5po2",
    "franchise_slug": "godzilla"
  },
  {
    "slug": "godzilla-stern",
    "name": "Godzilla",
    "opdb_group_id": "GweeP",
    "franchise_slug": "godzilla"
  },
  {
    "slug": "goldeneye",
    "name": "Goldeneye",
    "opdb_group_id": "G43wE",
    "franchise_slug": "james-bond"
  },
  {
    "slug": "guardians-of-the-galaxy",
    "name": "Guardians of the Galaxy",
    "opdb_group_id": "GRWvz",
    "franchise_slug": "guardians-of-the-galaxy"
  },
  {
    "slug": "guns-n-roses",
    "name": "Guns N' Roses",
    "opdb_group_id": "GrPKV",
    "franchise_slug": "guns-n-roses"
  },
  {
    "slug": "guns-n-roses-jersey-jack-pinball",
    "name": "Guns N' Roses",
    "opdb_group_id": "GqZZ1",
    "franchise_slug": "guns-n-roses"
  },
  {
    "slug": "harlem-globetrotters",
    "name": "Harlem Globetrotters On Tour",
    "opdb_group_id": "GRnwQ",
    "franchise_slug": "harlem-globetrotters"
  },
  {
    "slug": "harley-davidson",
    "name": "Harley Davidson",
    "opdb_group_id": "G56lO",
    "franchise_slug": "harley-davidson"
  },
  {
    "slug": "harley-davidson-bally",
    "name": "Harley Davidson",
    "opdb_group_id": "Gr2L0",
    "franchise_slug": "harley-davidson"
  },
  {
    "slug": "heavy-metal",
    "name": "Heavy Metal",
    "opdb_group_id": "GoEej",
    "franchise_slug": "heavy-metal"
  },
  {
    "slug": "high-speed",
    "name": "High Speed",
    "opdb_group_id": "GRvzd",
    "series_slug": "high-speed"
  },
  {
    "slug": "hook",
    "name": "Hook",
    "opdb_group_id": "G42EQ",
    "franchise_slug": "hook"
  },
  {
    "slug": "hot-wheels",
    "name": "Hot Wheels",
    "opdb_group_id": "GEL31",
    "franchise_slug": "hot-wheels"
  },
  {
    "slug": "independence-day",
    "name": "Independence Day",
    "opdb_group_id": "G4doQ",
    "franchise_slug": "independence-day"
  },
  {
    "slug": "indiana-jones",
    "name": "Indiana Jones",
    "opdb_group_id": "G4e1d",
    "franchise_slug": "indiana-jones"
  },
  {
    "slug": "indiana-jones-the-pinball-adventure",
    "name": "Indiana Jones: The Pinball Adventure",
    "opdb_group_id": "G4xZy",
    "franchise_slug": "indiana-jones"
  },
  {
    "slug": "iron-maiden",
    "name": "Iron Maiden: Legacy of the Beast",
    "opdb_group_id": "G4dOQ",
    "franchise_slug": "iron-maiden"
  },
  {
    "slug": "iron-man",
    "name": "Iron Man",
    "opdb_group_id": "GRVq4",
    "franchise_slug": "iron-man"
  },
  {
    "slug": "james-bond-007",
    "name": "James Bond 007",
    "opdb_group_id": "GQKyP",
    "franchise_slug": "james-bond"
  },
  {
    "slug": "james-bond-007-60th-anniversary",
    "name": "James Bond 007 60th Anniversary",
    "opdb_group_id": "Ge1Dy",
    "franchise_slug": "james-bond"
  },
  {
    "slug": "james-bond-007-gottlieb",
    "name": "James Bond 007",
    "opdb_group_id": "G4PXJ",
    "franchise_slug": "james-bond"
  },
  {
    "slug": "johnny-mnemonic",
    "name": "Johnny Mnemonic",
    "opdb_group_id": "GR6W8",
    "franchise_slug": "johnny-mnemonic"
  },
  {
    "slug": "judge-dredd",
    "name": "Judge Dredd",
    "opdb_group_id": "GRoZw",